{
  "current_burn_version": "0.20.1",
  "observed_pre_release": "0.21.0-pre.1",
  "scan_scope": [
    "Cargo.toml",
    "src",
    "tests",
    "fixtures",
    "README.md",
    "ARCHITECTURE.md",
    "docs/reference.md",
    "docs/adr"
  ],
  "schema_version": "1",
  "summary": {
    "tag_counts": {
      "bpk_literal": 6,
      "burn_current_version": 9,
      "burn_mpk_export_format": 5,
      "burn_pre_release": 4,
      "burn_refresh_decision": 1,
      "mpk_literal": 64
    },
    "touchpoint_count": 72
  },
  "touchpoints": [
    {
      "path": "ARCHITECTURE.md",
      "tags": [
        "bpk_literal",
        "mpk_literal"
      ]
    },
    {
      "path": "Cargo.toml",
      "tags": [
        "burn_current_version"
      ]
    },
    {
      "path": "README.md",
      "tags": [
        "bpk_literal",
        "mpk_literal"
      ]
    },
    {
      "path": "docs/adr/033-burn-dependency-refresh.md",
      "tags": [
        "bpk_literal",
        "burn_current_version",
        "burn_pre_release",
        "burn_refresh_decision",
        "mpk_literal"
      ]
    },
    {
      "path": "docs/reference.md",
      "tags": [
        "burn_current_version"
      ]
    },
    {
      "path": "fixtures/artifact_exported_event.fixture.json",
      "tags": [
        "mpk_literal"
      ]
    },
    {
      "path": "fixtures/artifact_exported_event_with_calibration.fixture.json",
      "tags": [
        "mpk_literal"
      ]
    },
    {
      "path": "fixtures/artifact_upload_request.example.json",
      "tags": [
        "mpk_literal"
      ]
    },
    {
      "path": "fixtures/burn_bpk_migration_surface_inventory.example.json",
      "tags": [
        "burn_current_version",
        "burn_pre_release"
      ]
    },
    {
      "path": "fixtures/dashboard_events.jsonl",
      "tags": [
        "mpk_literal"
      ]
    },
    {
      "path": "fixtures/dashboard_profiling_summary.fixture.json",
      "tags": [
        "mpk_literal"
      ]
    },
    {
      "path": "fixtures/distributed_runtime_benchmark_run.example.json",
      "tags": [
        "burn_current_version"
      ]
    },
    {
      "path": "fixtures/distributed_runtime_profile.example.json",
      "tags": [
        "burn_current_version"
      ]
    },
    {
      "path": "fixtures/eval_pipeline_monitoring_event.fixture.json",
      "tags": [
        "mpk_literal"
      ]
    },
    {
      "path": "fixtures/eval_summary_success.fixture.json",
      "tags": [
        "mpk_literal"
      ]
    },
    {
      "path": "fixtures/huggingface_publish_receipt.example.json",
      "tags": [
        "mpk_literal"
      ]
    },
    {
      "path": "fixtures/infer_done_event.fixture.json",
      "tags": [
        "mpk_literal"
      ]
    },
    {
      "path": "fixtures/infer_error_artifact_not_found.fixture.json",
      "tags": [
        "mpk_literal"
      ]
    },
    {
      "path": "fixtures/infer_hotspot_summary.fixture.json",
      "tags": [
        "mpk_literal"
      ]
    },
    {
      "path": "fixtures/manifest.toml",
      "tags": [
        "mpk_literal"
      ]
    },
    {
      "path": "fixtures/optimized_model_local_profile.example.json",
      "tags": [
        "burn_mpk_export_format",
        "mpk_literal"
      ]
    },
    {
      "path": "fixtures/optimized_model_package_contract.example.json",
      "tags": [
        "burn_mpk_export_format",
        "mpk_literal"
      ]
    },
    {
      "path": "fixtures/profiling_hotspot_summary.fixture.json",
      "tags": [
        "mpk_literal"
      ]
    },
    {
      "path": "fixtures/text_pretraining_run.example.json",
      "tags": [
        "mpk_literal"
      ]
    },
    {
      "path": "src/bin/gen_fixtures.rs",
      "tags": [
        "mpk_literal"
      ]
    },
    {
      "path": "src/cmd_burn_bpk_migration_surface_inventory.rs",
      "tags": [
        "bpk_literal",
        "burn_current_version",
        "burn_mpk_export_format",
        "burn_pre_release",
        "mpk_literal"
      ]
    },
    {
      "path": "src/cmd_eval.rs",
      "tags": [
        "mpk_literal"
      ]
    },
    {
      "path": "src/cmd_hf_publish.rs",
      "tags": [
        "mpk_literal"
      ]
    },
    {
      "path": "src/infer.rs",
      "tags": [
        "mpk_literal"
      ]
    },
    {
      "path": "src/manifest.rs",
      "tags": [
        "mpk_literal"
      ]
    },
    {
      "path": "src/text_pretrain.rs",
      "tags": [
        "mpk_literal"
      ]
    },
    {
      "path": "src/train/artifacts.rs",
      "tags": [
        "mpk_literal"
      ]
    },
    {
      "path": "src/train/runtime.rs",
      "tags": [
        "mpk_literal"
      ]
    },
    {
      "path": "tests/artifact_contract.rs",
      "tags": [
        "mpk_literal"
      ]
    },
    {
      "path": "tests/artifact_upload_adapter.rs",
      "tags": [
        "mpk_literal"
      ]
    },
    {
      "path": "tests/burn_bpk_migration_surface_inventory.rs",
      "tags": [
        "bpk_literal"
      ]
    },
    {
      "path": "tests/calibration_export_contract.rs",
      "tags": [
        "mpk_literal"
      ]
    },
    {
      "path": "tests/calibration_infer_gate.rs",
      "tags": [
        "mpk_literal"
      ]
    },
    {
      "path": "tests/distributed_runtime_benchmark_harness.rs",
      "tags": [
        "burn_current_version"
      ]
    },
    {
      "path": "tests/eval_cli.rs",
      "tags": [
        "mpk_literal"
      ]
    },
    {
      "path": "tests/event_contract_catalog.rs",
      "tags": [
        "mpk_literal"
      ]
    },
    {
      "path": "tests/format_dependency_fit_catalog.rs",
      "tags": [
        "bpk_literal",
        "burn_current_version",
        "burn_pre_release",
        "mpk_literal"
      ]
    },
    {
      "path": "tests/framework_registry_resolution.rs",
      "tags": [
        "mpk_literal"
      ]
    },
    {
      "path": "tests/http_graceful_shutdown.rs",
      "tags": [
        "mpk_literal"
      ]
    },
    {
      "path": "tests/huggingface_publish_adapter.rs",
      "tags": [
        "mpk_literal"
      ]
    },
    {
      "path": "tests/infer_cli.rs",
      "tags": [
        "mpk_literal"
      ]
    },
    {
      "path": "tests/infer_drift_baseline.rs",
      "tags": [
        "mpk_literal"
      ]
    },
    {
      "path": "tests/infer_drift_baseline_approval.rs",
      "tags": [
        "mpk_literal"
      ]
    },
    {
      "path": "tests/infer_drift_baseline_bundle.rs",
      "tags": [
        "mpk_literal"
      ]
    },
    {
      "path": "tests/infer_drift_baseline_checkpoint.rs",
      "tags": [
        "mpk_literal"
      ]
    },
    {
      "path": "tests/infer_drift_baseline_handoff.rs",
      "tags": [
        "mpk_literal"
      ]
    },
    {
      "path": "tests/infer_drift_baseline_history.rs",
      "tags": [
        "mpk_literal"
      ]
    },
    {
      "path": "tests/infer_drift_baseline_pointer.rs",
      "tags": [
        "mpk_literal"
      ]
    },
    {
      "path": "tests/infer_drift_baseline_refresh.rs",
      "tags": [
        "mpk_literal"
      ]
    },
    {
      "path": "tests/infer_drift_baseline_rollback.rs",
      "tags": [
        "mpk_literal"
      ]
    },
    {
      "path": "tests/infer_drift_baseline_supersession.rs",
      "tags": [
        "mpk_literal"
      ]
    },
    {
      "path": "tests/infer_drift_baseline_transport_locator.rs",
      "tags": [
        "mpk_literal"
      ]
    },
    {
      "path": "tests/infer_drift_receipt.rs",
      "tags": [
        "mpk_literal"
      ]
    },
    {
      "path": "tests/infer_logits_numerics.rs",
      "tags": [
        "mpk_literal"
      ]
    },
    {
      "path": "tests/infer_manifest.rs",
      "tags": [
        "mpk_literal"
      ]
    },
    {
      "path": "tests/infer_output_drift_summary.rs",
      "tags": [
        "mpk_literal"
      ]
    },
    {
      "path": "tests/infer_path.rs",
      "tags": [
        "mpk_literal"
      ]
    },
    {
      "path": "tests/optimized_model_local_profile.rs",
      "tags": [
        "burn_mpk_export_format",
        "mpk_literal"
      ]
    },
    {
      "path": "tests/optimized_model_package_contract.rs",
      "tags": [
        "burn_mpk_export_format"
      ]
    },
    {
      "path": "tests/profiling_artifact.rs",
      "tags": [
        "mpk_literal"
      ]
    },
    {
      "path": "tests/profiling_infer_command.rs",
      "tags": [
        "mpk_literal"
      ]
    },
    {
      "path": "tests/profiling_provenance_evidence_bundle.rs",
      "tags": [
        "mpk_literal"
      ]
    },
    {
      "path": "tests/profiling_recipe_current_pointer.rs",
      "tags": [
        "mpk_literal"
      ]
    },
    {
      "path": "tests/rollout_orchestration_commands.rs",
      "tags": [
        "mpk_literal"
      ]
    },
    {
      "path": "tests/support/manifest_paths.rs",
      "tags": [
        "mpk_literal"
      ]
    },
    {
      "path": "tests/support/runtime_model_artifact.rs",
      "tags": [
        "mpk_literal"
      ]
    },
    {
      "path": "tests/text_pretraining_adapter.rs",
      "tags": [
        "mpk_literal"
      ]
    }
  ]
}